来源,时间,公司规模,英文名字,中文名字,公司简称,法人,成立日期,注册资本(万元）,联系人,联系人职位,职位名称,最低工资,最高工资,工资范围,招人数,工作经验 （年数）,学历要求,行业,公司经营地址,经营范围
58Job,2021-08-09,100-499人,,深圳福满丽通科技发展有限公司,福满丽通,黄燕冰,2015-04-10,50万人民币,,,外贸跟单-双休,3500,6800,3500-6800元/月,招2人,1-2年,大专,原材料和加工,六约社区麟恒中心广场B1座1803,一般经营项目是：国内贸易；货物及技术进出口；投资兴办实业（具体项目另行申报）；民用口罩、面罩销售（医用口罩销售需取得二类医疗器械经营备案后方可经营）。，许可经营项目是：日用品、床上用品、百货、玩具、五金塑胶、电子产品、服装、文具的研发及生产加工与销售；民用口罩、面罩生产。
58Job,2021-08-09,50-99人,,深圳市遇爱贸易有限公司,遇爱贸易,许伟春,2018-06-13,100万人民币,,,外贸业务员,5000,8000,5000-8000元/月,招5人,"经验不限,可接收应届生",大专,贸易/进出口+交通/运输/物流+批发/零售,深圳宝安沙井新桥街道中心路同方创想公社1025,一般经营项目是：成人玩具的技术研发；情趣服饰、健慰器、润滑油、五金制品、硅橡胶及塑胶制品、工艺礼品（象牙及其制品除外）的销售；国内贸易，货物及技术进出口。(法律、行政法规、国务院决定规定在登记前须经批准的项目除外），许可经营项目是：避孕套、成人玩具、健慰器、润滑油的生产与销售；情趣服饰、五金制品、硅橡胶、塑胶制品、工艺礼品（象牙及其制品除外）的生产；二类医疗器械的批发与零售。
58Job,2021-08-09,100-499人,,深圳市科莱达环保设备有限公司,奥特宝家饰（深圳）,陈延平,2000-11-23,3800万港元,,,外贸业务经理,,,薪资面议,招1人,3-5年,大专,原材料和加工,深圳光明观光路联大工业园联大集团,一般经营项目是：货物或技术进出口。，许可经营项目是：生产经营海棉、海棉制品、床垫、枕头、坐垫、靠垫、汽车用品、家居用品；聚氨酯材料的研发、生产、销售。
58Job,2021-08-09,100-499人,,深圳威仕麦电子有限公司,首品精密,肖作礼,2010-04-28,300万人民币,,,外贸业务（应届毕业生可）,10000,15000,10000-15000元/月,招2人,经验不限,学历不限,原材料和加工,深圳宝安福永凤凰社区兴业二路10号A栋,一般经营项目是：手板模型、塑胶制品、五金制品的设计与销售；自有物业租赁；国内贸易。，许可经营项目是：手板模型、塑胶制品、五金制品的生产。
58Job,2021-08-09,1-49人,,深圳市合盛创杰科技有限公司,益华诚,郭青华,2012-07-06,50万人民币,,,外贸业务员,8000,10000,8000-10000元/月,招6人,"1-2年,可接收应届生",大专,其他行业,深圳宝安沙井沙二蓝天科技园5栋一楼,一般经营项目是：塑胶模具、五金模具的生产加工；国内贸易，货物及技术进出口。（以上均不含再生资源回收经营及法律、行政法规、国务院决定规定在登记前须经批准的项目），许可经营项目是：
58Job,2021-08-09,1-49人,,深圳市八颗贸易有限公司,金来科技,钟立胜,2012-03-15,50万人民币,,,高薪急招外贸业务员,6000,12000,6000-12000元/月,招10人,1-2年,大专,贸易/进出口,深圳龙岗区龙岗中心城龙翔大道珠江国际1703,一般经营项目是：LED灯具的研发、购销；投资兴办实业（具体项目另行申报）；网页设计；国内贸易（法律、行政法规、国务院决定规定在登记前须经批准的项目除外）；货物及技术进出口（法律、行政法规禁止的项目除外；法律、行政法规限制的项目须取得许可后方可经营）。，许可经营项目是：
58Job,2021-08-09,1-49人,,安鑫五金塑胶（香港）有限公司,安鑫五金,刘芳,2018-03-28,50万人民币,,,外贸业务员+五险包吃住,4000,8000,4000-8000元/月,招3人,"1-2年,可接收应届生",大专,其他行业,深圳宝安燕罗街道塘下涌社区广田路224号A栋201,一般经营项目是：电子产品、五金制品、塑胶制品、模具、摄影器材的销售；国内贸易；经营进出口业务。(法律、行政法规、国务院决定规定在登记前须经批准的项目除外；涉及行政许可的，须取得行政许可文件后方可经营），许可经营项目是：电子产品、五金制品、塑胶制品、模具、摄影器材的生产。
58Job,2021-08-09,1-49人,,深圳市富士狼电子有限公司,发光礼品,黄瑞燃,2013-01-21,50万人民币,,,B2B外贸业务员6K起,6000,12000,6000-12000元/月,招2人,1-2年,大专,互联网/电子商务+批发/零售+贸易/进出口,西乡街道南昌华丰工业园2栋2楼,一般经营项目是：发光产品、发光礼品、发光玩具、体育用品、装饰产品、酒具、发光家具、婚庆用品、电子产品、餐具、美妆工具、电子礼品、儿童玩具、电脑周边产品、音箱、电源适配器、手机周边产品、数码产品、舞台灯设备、户外运动用品、办公文教用品（不含教材等出版物）、汽车用品、安防产品、数码家电、宠物用品的技术开发与销售；口罩、护目镜、防护服、防护面罩、测温仪、吸鼻器、消毒液、消毒器具、手套的销售。（法律、行政法规或者国务院决定禁止和规定在登记前须经批准的项目除外），许可经营项目是：电子产品的生产。
58Job,2021-08-09,50-99人,,深圳市旺盈彩盒纸品有限公司,创鑫海,王成海,2012-03-21,50万人民币,,,外贸专员,6000,9000,6000-9000元/月,招2人,"经验不限,可接收应届生",学历不限,出版/印刷/造纸,深圳市宝安23区大宝路一巷一号艾可工业区C栋5楼,一般经营项目是：工艺制品（象牙及其制品除外）、电子礼品、礼品配套零部件、工艺品（象牙及其制品除外）配套零部件的设计、技术开发、信息咨询服务与销售；企业管理咨询（不含人才中介服务）；企业管理培训；商务信息咨询（不含限制项目）；市场策划咨询；国内贸易，货物及技术进出口。(法律、行政法规、国务院决定规定在登记前须经批准的项目除外），许可经营项目是：工艺制品、电子礼品、礼品配套零部件、工艺品配套零部件的生产；非医用口罩的加工、销售。
58Job,2021-08-09,50-99人,,深圳市君安康医疗科技有限公司,君安康,张勇,2004-08-20,2000万人民币,,,外贸专员外贸推广,6000,10000,6000-10000元/月,招1人,1-2年,大专,生物/制药/医疗器械,深圳龙岗区宝龙工业区翠宝路28号赛格导航科技园,一般经营项目是：一类医疗器械、显示屏、自助终端机、电子产品、计算机软硬件、打印机耗材、网络数码产品、图像设备的技术开发与购销及售后维修服务；国内贸易；货物及技术进出口。（法律、行政法规禁止的项目除外；法律、行政法规限制的项目须取得许可后方可经营）。，许可经营项目是：二类医疗器械、三类医疗器械的技术开发与购销及售后维修服务；一类医疗器械、二类医疗器械、三类医疗器械、显示屏、自助终端机、电子产品、计算机软硬件的生产。
58Job,2021-08-09,100-499人,,深圳青出蓝生物技术有限公司,皓源电子,刘建梁,2016-09-28,500万人民币,,,外贸助理,5000,10000,5000-10000元/月,招5人,"1-2年,可接收应届生",大专,生物/制药/医疗器械+互联网/电子商务,深圳龙华观澜观光路锦富大厦306,一般经营项目是：国内贸易；经营进出口业务；经营电子商务；电子产品、3C数码、玩具、电脑办公用品、日用百货、通讯设备、服装鞋帽、箱包、皮革制品、五金配件、塑胶制品、手机配件、包装盒、皂液器、电池、电子烟、成人用品的销售。，许可经营项目是：医疗器械的技术研发与生产；医疗器械的销售;成人用品、电子烟的生产及加工；互联网信息服务。（依法须经批准的项目，经相关部门批准后方可开展经营活动，具体经营项目以相关部门批准文件或许可证件为准）
58Job,2021-08-09,100-499人,,深圳市乐翔电气有限公司,乐翔电气,陆志春,2009-08-19,1300万人民币,,,外贸跟单,5000,7000,5000-7000元/月,招2人,"3-5年,可接收应届生",大专,互联网/电子商务+贸易/进出口+批发/零售,广东省深圳市宝安区松岗山门工业区5号厂房,一般经营项目是：电气产品、电子产品、电脑配件、电脑周边产品、塑胶制品、音响器材及零配件的生产与销售；货物及技术进出口。（法律、行政法规、国务院决定规定在登记前须经批准的项目除外），许可经营项目是：
58Job,2021-08-09,1-49人,,深圳市盛贸彩印有限公司,铭盛达,李祥月,2007-09-24,150万人民币,,,外贸业务员,10000,20000,10000-20000元/月,招2人,"经验不限,可接收应届生",大专,出版/印刷/造纸,吉华街道秀峰工业城A5栋5楼东面铭盛达公司,一般经营项目是：国内贸易（法律、行政法规、国务院决定规定在登记前须经批准的项目除外）。，许可经营项目是：包装装潢印刷品、其他印刷品的印刷。
58Job,2021-08-09,50-99人,,深圳市美尔俊箱包有限公司,美尔俊,余美华,2007-09-17,200万人民币,,,诚聘外贸业务+五险包住,5500,10000,5500-10000元/月,招4人,"1-2年,可接收应届生",大专,贸易/进出口+服装/纺织/皮革,深圳宝安区沙井街道建安路6号恒强工业员E栋三楼,一般经营项目是：礼品袋、包装袋、化妆包、背包、公文包、旅行包、野餐包、包装制品的生产（不含印刷）与销售；国内贸易；货物及技术进出口。（不含再生资源非回收经营及法律、行政法规、国务院决定规定在登记前须经批准的项目），许可经营项目是：
58Job,2021-08-09,1-49人,,深圳青出蓝生物技术有限公司,冠泰新,吕海燕,2006-06-13,50万人民币,,,外贸专员/助理,,,薪资面议,招若干人,经验不限,学历不限,贸易/进出口+原材料和加工,深圳龙华区观澜福民悦兴围工业区A栋一四楼,一般经营项目是：绝缘套管、电子元器件、光纤光缆、光通信器件、光缆分接箱、五金化工的销售(不含危险化学品、易制毒化学品)。国内商业、物资供销业、货物及技术进出口。(以上均不含法律、行政法规、国务院决定禁止及规定需前置审批项目)，许可经营项目是：光纤保护套管、热缩套管的生产。
58Job,2021-08-09,50-99人,,深圳市魔诺科科技有限公司,海德精密,周圣斌,2007-06-29,200万人民币,,,急招外贸业务员6-8K起,6000,8000,6000-8000元/月,招2人,1-2年,高中,原材料和加工,深圳南山西丽街道松白路1026号南岗第二工业园8栋101A,一般经营项目是：陶瓷材料、陶瓷产品、机械零件的生产、购销与技术开发（深南环批[2011]52448号）；其他国内贸易；经营进出口业务（以上法律、行政法规、国务院决定禁止的项目除外，限制的项目须取得许可后方可经营）。，许可经营项目是：
58Job,2021-08-09,50-99人,,深圳市海芝通电子股份有限公司,海芝,李秀琴,2006-06-07,2138.8875万人民币,,,外贸业务员,6000,9000,6000-9000元/月,招5人,经验不限,学历不限,其他行业,面试深圳宝安福永方格凤凰科技大楼1单元1001,一般经营项目是：研发、经营锂电池、电源开关、模块、太阳能板、充电宝和可穿戴设备、国内外产品、技术出口贸易。，许可经营项目是：生产锂电池、电源开关、模块、太阳能板、充电宝和可穿戴设备。
58Job,2021-08-09,50-99人,,深圳市米高彤电子有限公司,米高彤,刘阿丽,2014-12-31,50万人民币,,,外贸业务员高薪,10000,20000,10000-20000元/月,招5人,经验不限,学历不限,互联网/电子商务,深圳龙岗区布吉丹竹头立信路91号1A302,一般经营项目是：经营电子商务，电子产品、玩具、五金制品的研发设计与销售，国内贸易（不含专营、专控、专卖商品）；货物及技术进出口。，许可经营项目是：
58Job,2021-08-09,50-99人,,深圳市优艺硅橡胶制品有限公司,捷尔钻,刘宏亮,2011-08-03,200万人民币,,,外贸业务员,4000,8000,4000-8000元/月,招若干人,经验不限,高中,原材料和加工+多元化集团,广东省深圳市光明区马田街道薯田埔社区新兴工业区D区第五栋103,一般经营项目是：模具产品、塑胶件、五金件、硅橡胶件、电子配件、不干胶模切产品的技术开发与销售；包装材料的销售；国内贸易、货物及技术进出口（法律、行政法规、国务院决定规定在登记前须经批准的项目除外）。，许可经营项目是：模具产品、塑胶件、五金件、硅橡胶件、电子配件、不干胶模切产品的生产
58Job,2021-08-09,50-99人,,深圳市正芯城电子科技有限公司,,叶继盛,2012-03-20,500万人民币,,,外贸销售业务员+五险一金,6000,12000,6000-12000元/月,招5人,经验不限,学历不限,电子技术/半导体/集成电路+互联网/电子商务,深圳福田上梅林新一代产业园,一般经营项目是：电子元器件、电子产品、数码产品的销售及其他国内贸易（法律、行政法规、国务院决定规定在登记前须经批准的项目除外）；货物及技术进出口（法律、行政法规、国务院决定禁止的项目除外，限制的项目须取得许可后方可经营）。，许可经营项目是：
58Job,2021-08-09,50-99人,,深圳市富斯特威电子有限公司,,叶继盛,2012-03-20,500万人民币,,,诚聘外贸业务员+五险一金,8000,16000,8000-16000元/月,招5人,经验不限,大专,电子技术/半导体/集成电路+互联网/电子商务,深圳福田上梅林新一代产业园,一般经营项目是：电子元器件、电子产品、数码产品的销售及其他国内贸易（法律、行政法规、国务院决定规定在登记前须经批准的项目除外）；货物及技术进出口（法律、行政法规、国务院决定禁止的项目除外，限制的项目须取得许可后方可经营）。，许可经营项目是：
58Job,2021-08-09,100-499人,,深圳市皓源电子有限公司,皓源电子,刘建梁,2016-09-28,500万人民币,,,外贸业务员,6000,12000,6000-12000元/月,招5人,1-2年,大专,生物/制药/医疗器械+互联网/电子商务,深圳龙华观澜观光路锦富大厦306,一般经营项目是：国内贸易；经营进出口业务；经营电子商务；电子产品、3C数码、玩具、电脑办公用品、日用百货、通讯设备、服装鞋帽、箱包、皮革制品、五金配件、塑胶制品、手机配件、包装盒、皂液器、电池、电子烟、成人用品的销售。，许可经营项目是：医疗器械的技术研发与生产；医疗器械的销售;成人用品、电子烟的生产及加工；互联网信息服务。（依法须经批准的项目，经相关部门批准后方可开展经营活动，具体经营项目以相关部门批准文件或许可证件为准）
58Job,2021-08-09,1-49人,,瀚马（深圳）电子有限公司,瀚马电子,侯松,2017-08-03,500万人民币,,,外贸销售,5000,10000,5000-10000元/月,招6人,"1-2年,可接收应届生",大专,计算机硬件+计算机软件+互联网/电子商务,深圳光明公明街道李松蓢凯博科技园,一般经营项目是：电子产品的技术开发及销售、国内贸易、货物及技术进出口。，许可经营项目是：电子产品的生产
58Job,2021-08-09,50-99人,,深圳市丫丫礼品有限公司,丫丫礼品,张玉珠,2015-12-31,100万人民币,,,聘请国际外贸业务伙伴,6000,12000,6000-12000元/月,招3人,经验不限,学历不限,原材料和加工+其他行业,深圳坪山新区宝山第二工业区77栋,一般经营项目是：国内贸易（不含专营、专卖、专控商品）；经营进出口业务（法律、行政法规、国务院决定禁止的项目除外，限制的项目须取得许可后方可经营）。，许可经营项目是：硅橡胶制品、汽车用品、手机周边硅胶件、塑胶制品、工艺品、礼品的设计、技术开发、加工、生产与销售。
58Job,2021-08-09,50-99人,,深圳市创新达电子科技有限公司,创新达,陈明森,2003-06-12,50万人民币,,,外贸业务员/外贸销售,,,薪资面议,招6人,1-2年,大专,贸易/进出口+电子技术/半导体/集成电路,深圳福田华强北佳和大厦B座1811,一般经营项目是：电子产品的技术开发与销售，国内商业、物资供销业；经营进出口业务。，许可经营项目是：
58Job,2021-08-09,1-49人,,深圳市佳居坊贸易有限公司,佳居坊贸易,何秉毅,2006-11-29,50万人民币,,,龙岗中心城/外贸跟单,5000,8000,5000-8000元/月,招5人,"1-2年,可接收应届生",大专,贸易/进出口,长兴北路3号中央悦城10栋,一般经营项目是：国内贸易，机电产品、日用品、建材、通讯产品的购销（以上均不含专营、专控、专卖商品）；信息咨询（不含限制项目）；货物进出口、技术进出口（法律、行政法规禁止的项目除外；法律、行政法规限制的项目须取得许可后方可经营）。，许可经营项目是：
58Job,2021-08-09,1-49人,,深圳市捷英特进出口有限公司,佳居坊贸易,何秉毅,2006-11-29,50万人民币,,,龙岗中心城/外贸跟单,5000,8000,5000-8000元/月,招5人,"1-2年,可接收应届生",大专,贸易/进出口,长兴北路3号中央悦城10栋,一般经营项目是：国内贸易，机电产品、日用品、建材、通讯产品的购销（以上均不含专营、专控、专卖商品）；信息咨询（不含限制项目）；货物进出口、技术进出口（法律、行政法规禁止的项目除外；法律、行政法规限制的项目须取得许可后方可经营）。，许可经营项目是：
58Job,2021-08-09,1-49人,,深圳市润鹏精密五金有限公司,润,肖永忠,2003-08-19,400万人民币,,,外贸助理,4500,6500,4500-6500元/月,招1人,"经验不限,可接收应届生",学历不限,其他行业,深圳市润鹏精密五金有限公司,一般经营项目是：模具注塑、五金加工及装配、连接器的生产与销售；电子产品的技术开发与产品销售；投资兴办实业（具体项目另行申报）；企业管理信息咨询；国内贸易；货物及技术进出口。（以上均不含法律，行政法规，国务院决定禁止及规定需前置审批项目），许可经营项目是：模具注塑、五金加工及装配、连接器的生产
58Job,2021-08-09,100-499人,,深圳市科创尔电器有限公司,,刘年俊,2010-08-10,50万人民币,,,急聘外贸业务员有意电联,,,薪资面议,招1人,3-5年,大专,电子技术/半导体/集成电路+家具灯饰,广东省深圳市龙岗区环城南路顺丰路127-5,一般经营项目是：家用电器的购销；五金制品的购销（不含再生资源回收经营）；国内贸易（法律、行政法规、国务院决定规定在登记前须经批准的项目除外）；货物及技术进出口（法律、行政法规禁止的项目除外；法律、行政法规限制的项目须取得许可后方可经营）。，许可经营项目是：云母发热架、不锈钢加热管、美容美发仪的生产加工及销售。
58Job,2021-08-09,50-99人,,深圳市创新通科技发展有限公司,创,殷新荣,2006-09-20,300万人民币,,,外贸经理+高薪,7000,12000,7000-12000元/月,招1人,经验不限,大专,钢铁/机械/设备/重工,中国广东省深圳市龙华区观澜章阁硅谷动力低碳工业园A5\/2,一般经营项目是：电子产品、机电一体化产品、智能通道系统的技术开发及生产，国内贸易，货物及技术进出口。（法律、行政法规、国务院决定规定在登记前须经批准的项目除外），许可经营项目是：
58Job,2021-08-09,1-49人,,深圳华泽光电科技有限公司,华泽光电,彭婷,2015-11-19,5100万人民币,,,外贸业务员,5000,10000,5000-10000元/月,招10人,1-2年,学历不限,广告/创意+电子技术/半导体/集成电路,深圳宝安石岩石龙仔社区汇龙达大厦15楼1510B,一般经营项目是：LED显示屏、LED灯、LED灯具、LED应用产品、电源、电子产品的研发与销售；光电产品及其他LED能源应用产品的技术开发与销售；LED显示控制软件的技术开发与销售；计算机软件开发；LED灯安装工程设计与施工；电子设备及自产产品的上门安装、上门维护、技术咨询及租赁；节能项目设计、技术咨询；国内贸易，货物及技术进出口；弱电工程的设计与施工；系统集成；通讯产品。（法律、行政法规禁止的项目除外；法律、行政法规限制的项目须取得许可后方可经营），许可经营项目是：LED显示屏、LED应用相关产品、LED照明产品的研发、生产加工。
58Job,2021-08-09,1-49人,,昌泰电器科技（深圳）有限公司,鼎创视界,罗琦,2015-05-20,1688万人民币,,,外贸业务员,,,薪资面议,招3人,"经验不限,可接收应届生",学历不限,互联网/电子商务,恒明珠沙井科技工业园10栋西边2楼,"一般经营项目是：液晶拼接显示单元、液晶监视器、电子产品、一体机、广告机、数字标牌、高清播放盒、电子白板、LED显示屏、视频图像处理器、解码器、矩阵、多媒体系统、五金支架、监视器、商用显示器、智慧信息管理系统、机器人、安防监控计算机商用会议教学产品软硬件的技术研发与销售;国内贸易,货物及技术进出口。（法律、行政法规、国务院决定禁止的项目除外，限制的项目须取得许可后方可经营），许可经营项目是：液晶监视器、电子产品、广告机、数字标牌、高清播放盒、电子白板、液晶拼接显示单元、LED显示屏、一体机、视频图像处理器、解码器、矩阵、多媒体系统、五金支架、监视器、商用显示器、智慧信息管理系统、机器人、安防监控计算机商用会议教学产品软硬件的生产。"
58Job,2021-08-09,50-99人,,深圳市瑞美展示制品有限公司,瑞美展示,胡吉会,2013-04-11,10万人民币,,,外贸业务员+包住五险,4000,8000,4000-8000元/月,招10人,经验不限,大专,其他行业,深圳龙岗龙岗中心城新联社区如意路114号瑞美实业有限公司,一般经营项目是：展示制品的技术研发与销售；国内贸易；货物及技术进出口。，许可经营项目是：木器、亚克力制品、五金、塑胶制品的生产与销售。
58Job,2021-08-09,1-49人,,深圳市唐彩照明科技有限公司,唐彩照明,刘鳗娇,2005-12-31,1000万人民币,,,外贸销售员包吃住+五险,4500,6500,4500-6500元/月,招3人,经验不限,学历不限,贸易/进出口,深圳宝安沙井沙四高新工业园G栋,一般经营项目是：生产LED灯、LED投光灯、LED其他灯具（不含除油、酸洗、喷漆），发光二极管、照明应用产品、电子产品、软件产品的技术开发及销售；国内商业、物资供销业（以上不含专营、专控、专卖商品)；货物进出口、技术进出口（法律、行政法规禁止的项目除外；法律、行政法规限制的项目须取得许可后方可经营）。，许可经营项目是：
58Job,2021-08-09,1-49人,,深圳市盛飞达精密模具有限公司,唐彩照明,刘鳗娇,2005-12-31,1000万人民币,,,外贸销售员包吃住+五险,8000,12000,8000-12000元/月,招3人,经验不限,学历不限,贸易/进出口,深圳宝安沙井沙四高新工业园G栋,一般经营项目是：生产LED灯、LED投光灯、LED其他灯具（不含除油、酸洗、喷漆），发光二极管、照明应用产品、电子产品、软件产品的技术开发及销售；国内商业、物资供销业（以上不含专营、专控、专卖商品)；货物进出口、技术进出口（法律、行政法规禁止的项目除外；法律、行政法规限制的项目须取得许可后方可经营）。，许可经营项目是：
58Job,2021-08-09,1-49人,,深圳市唐彩照明科技有限公司,唐彩照明,刘鳗娇,2005-12-31,1000万人民币,,,外贸销售员包吃住+五险,4500,6500,4500-6500元/月,招3人,经验不限,学历不限,贸易/进出口,深圳宝安沙井沙四高新工业园G栋,一般经营项目是：生产LED灯、LED投光灯、LED其他灯具（不含除油、酸洗、喷漆），发光二极管、照明应用产品、电子产品、软件产品的技术开发及销售；国内商业、物资供销业（以上不含专营、专控、专卖商品)；货物进出口、技术进出口（法律、行政法规禁止的项目除外；法律、行政法规限制的项目须取得许可后方可经营）。，许可经营项目是：
