来源,时间,公司规模,英文名字,中文名字,公司简称,法人,成立日期,注册资本(万元）,联系人,联系人职位,职位名称,最低工资,最高工资,工资范围,招人数,工作经验 （年数）,学历要求,行业,公司经营地址,经营范围
,2021-08-09,100-499人,,深圳仨合科技贸易有限公司,仨合国际集团,李兵,2016-11-09,100万人民币,张女士,人事,Amazon精品运营/亚马逊运营/B2B外贸业务员,7000,12000,7-12K·13薪,-,经验不限,大专,贸易/进出口,深圳宝安区华丰智谷福海科技产业园A栋330,一般经营项目是：依托于第三方开展光电产品、机械设备、太阳能产品、电源电器、电子产品、工艺礼品（不含象牙及其制品）、五金产品及周边配件、服装、服装配饰、腰带、户外用品、箱包、母婴用品、宠物用品、扣具、织带、汽车和户外动力设备、化妆品、手机和配件、珠宝首饰、消费类电子产品、个人护理产品、家居厨房用品、工业和科学用品、视频器材、办公用品、家居园艺、玩具、视频游戏机的销售；计算机软件技术开发和销售；光电产品、机械设备、太阳能产品、电源电器，电子产品、工艺礼品（不含象牙及其制品）、五金产品及周边配件、服装、服装配饰、腰带、户外用品、箱包、母婴用品、宠物用品、扣具、织带、汽车和户外动力设备、化妆品、手机和配件、珠宝首饰、消费类电子产品、个人护理产品、家居厨房用品、工业和科学用品、视频器材、办公用品、家居园艺、玩具、视频游戏机的进出口及相关配套业务；软件的技术开发和销售；企业咨询管理；企业营销策划（不含中介，证券，保险，基金，金融业务及其他限制项目）；商务信息咨询（不含职业介绍及其他限制项目）。（以上均不涉及外商投资准入特别管理措施项目，限制的项目须取得许可后方可经营），许可经营项目是：仓储服务;第二类医疗器械的销售；依托于第三方开展书籍的销售；书籍的进出口业务。
58Job,2021-08-09,1-49人,,深圳市物华天宝软件有限公司,千晟电声,曾健,2009-07-03,1000万人民币,,,外贸销售员/英语翻译业务,8000,12000,8000-12000元/月,招2人,"经验不限,可接收应届生",大专,IT服务/系统集成,深圳龙岗区横岗街道大康社区莘塘新龙路21号3栋,一般经营项目是：音响、灯光、舞台机机械、弱电集成系统、音视频集成系统的工程设计、安装调试、销售及维护;音视频集成技术的开发与技术转让;文化演出器材的租赁，国内贸易，经营进出口业务。，许可经营项目是：电子产品、音响、音响设备、灯光设备、舞台机械设备、视频设备、电教设备、智能自动化控制系统、专业声学材料、LED显示屏、多媒体音视频会议系统的设备研发、销售及生产加工。
,2021-08-09,20-99人,,深圳市达沃电子有限公司,达沃,周勇华,2010-06-24,500万人民币,吴女士,总经理,高薪急聘外贸专员,8000,10000,8-10K,-,1-3年,本科,原材料及加工/模具,深圳广东省深圳市宝安区三号路5号4楼,一般经营项目是：电子产品、集成电路的技术开发与销售，五金产品、自助终端设备、电脑外设、智能设备、计算机软件、信息系统软件的开发、销售；信息系统设计、集成、上门维护。经营电子商务（涉及前置行政许可的，须取得前置性行政许可文件后方可经营）；国内贸易、货物及技术进出口。（法律、行政法规或者国务院决定禁止和规定在登记前须经批准的项目除外）；非居住房地产租赁。（除依法须经批准的项目外，凭营业执照依法自主开展经营活动），许可经营项目是：计算机软硬件及外围设备制造。
58Job,2021-08-09,100-499人,,深圳市中聚泰光电科技有限公司,中聚泰,张艳萍,2002-03-05,3000万人民币,,,外贸业务员,5000,8000,5000-8000元/月,招2人,1-2年,大专,通信/电信+仪器仪表/工业自动化+汽车/摩托车,深圳光明新区公明镇公明街道田寮社区怡景工业城A5栋4楼,一般经营项目是：五金塑胶产品、检测仪器、网络安全设备、电子元器件、车载导航系统软硬件、机器设备、汽车连接器、汽车零部件、汽车天线、汽车线束、模具的开发及销售；汽车系统的开发及销售；服装销售；医疗口罩、一次性使用口罩、额温枪、耳温枪、红外热成像温测仪、智能电子口罩的销售，二类医疗器械批发及零售（备案后方可销售）。，许可经营项目是：五金塑胶产品、检测仪器、网络安全设备、电子元器件、车载导航系统软硬件、机器设备、汽车连接器、汽车零部件、汽车天线、汽车线束、模具的生产。
,2021-08-03,20-99人,,深圳市视可安科技有限公司,视可安,刘宇,2005-09-23,50万人民币,胡女士,HR,外贸运营,6000,10000,6-10K,-,1-3年,本科,贸易/进出口,深圳福田区杭钢富春商务大厦2511,一般经营项目是：液晶电视、摄像机、电脑软件及相关电子产品的技术开发；国内贸易（法律、行政法规、国务院决定规定在登记前须批准的项目除外）；经营进出口业务（法律、行政法规、国务院决定禁止的项目除外，限制的项目须取得许可后方可经营）。，许可经营项目是：
58Job,2021-08-09,100-499人,,深圳市万家照明有限公司,万家照明,李飞,2008-04-16,100万人民币,,,外贸业务员,4000,6000,4000-6000元/月,招5人,1-2年,大专,电子技术/半导体/集成电路,深圳龙岗区平湖街道富民工业区芳坑路100号,一般经营项目是：照明设备的技术开发、生产加工、销售；国内贸易（法律、行政法规、国务院决定规定在登记前须经批准的项目除外）；货物进出口、技术进出口（法律、行政法规禁止的项目除外；法律、行政法规限制的项目须取得许可后方可经营）。，许可经营项目是：
58Job,2021-08-09,1-49人,,深圳市冠泰新材料有限公司,冠泰新,吕海燕,2006-06-13,50万人民币,,,龙华工厂双休外贸主管,6000,8000,6000-8000元/月,招2人,1-2年,大专,贸易/进出口+原材料和加工,深圳龙华新区观澜福前路76号悦兴围工业区,一般经营项目是：绝缘套管、电子元器件、光纤光缆、光通信器件、光缆分接箱、五金化工的销售(不含危险化学品、易制毒化学品)。国内商业、物资供销业、货物及技术进出口。(以上均不含法律、行政法规、国务院决定禁止及规定需前置审批项目)，许可经营项目是：光纤保护套管、热缩套管的生产。
,2021-08-02,20-99人,,深圳市兰博睿科技有限公司,兰博睿,许悦玲,2011-08-05,10万人民币,许女士,业务经理,有提成~外贸跟单业务助理,6000,11000,6-11K,-,1-3年,大专,贸易/进出口,深圳龙岗区坂田国际中心C2-409,一般经营项目是：纺织品、服装、服饰、鞋帽、电子产品、婚庆用品、发光家具、LED灯饰的销售；网络技术开发；半导体发光二极管产品和消费类电子产品的销售国内贸易、货物及技术进出口（法律、行政法规、国务院决定规定在登记前须经批准的项目除外）；经营电子商务（涉及前置性行政许可的，须取得前置性行政许可文件后方可经营）。，许可经营项目是：发光家具、LED灯饰的生产。
58Job,2021-08-09,1-49人,,深圳市星征程科技有限公司,深圳都来米科技,姜黎黎,2011-01-17,100万人民币,,,外贸专员,5000,8000,5000-8000元/月,招2人,"经验不限,可接收应届生",大专,互联网/电子商务+贸易/进出口,南贤商业广场A座,一般经营项目是：计算机软硬件、电子产品技术开发（不含生产加工）及销售、技术咨询；安防产品、五金机电、办公用品销售；国内贸易，经营进出口业务 。(法律、行政法规或者国务院决定禁止和规定在登记前须经批准的项目除外)，许可经营项目是：
58Job,2021-08-09,1-49人,,深圳市亿莱顿科技有限公司,亿莱顿,庄诚,2008-07-09,5000万人民币,,,外贸助理/跟单,6000,9000,6000-9000元/月,招1人,经验不限,学历不限,电子技术/半导体/集成电路,深圳宝安松岗街道潭头社区盈丰工业园厂房2栋,一般经营项目是：广告机、数码相框、液晶显示器、播放器、平板电脑、投影仪、评价器、安卓一体机、高清机顶盒、一体机电脑、数字标牌等电子产品的技术开发和销售及售后服务；电子元器件的销售及技术开发；广告机、数码相框、液晶显示器、播放器、平板电脑、电子产品的代加工；国内商业、物资供销业，货物及技术进出口。（以上项目均不含法律、行政法规、国务院规定禁止及决定需前置审批的项目），许可经营项目是：广告机、数码相框、液晶显示器、播放器、平板电脑、等电子产品的生产和代加工。
,2021-07-31,100-499人,,深圳市蓝威灵光电有限公司,蓝威灵光电,林少洲,2012-07-10,50万人民币,孙先生,运营主管,外贸文员,5000,8000,5-8K,-,在校/应届,大专,电子/半导体/集成电路,深圳龙岗区城投商务中心513,一般经营项目是：半导体照明产品、发光二极管、电子产品、电子元器件及其周边产品的技术开发与销售，国内贸易（不含专营、专控、专卖商品）；从事货物、技术进出口业务（不含分销、国家专营专控商品）。，许可经营项目是：
58Job,2021-08-09,1-49人,,深圳市银河系科技有限公司,新金科,代世梅,2011-08-15,50万人民币,,,国际外贸业务员,4500,9000,4500-9000元/月,招8人,经验不限,学历不限,计算机硬件,广东省深圳市福田区彩田南路彩虹大厦8A,一般经营项目是：投资兴办实业（具体项目另行申报）；数码产品、电子产品及配件、电子数据线、电子元器件、电脑及周边产品、办公用品的购销；计算机软硬件的技术开发、购销；计算机软件的上门维护；计算机周边产品的上门安装及上门维修；电子产品及配件的上门安装；国内贸易（法律、行政法规、国务院决定规定在登记前须经批准的项目除外）；货物及技术进出口（法律、行政法规禁止的项目除外；法律、行政法规限制的项目须取得许可后方可经营）。，许可经营项目是：
,2021-08-09,20-99人,,深圳市渝新欧科技有限公司,渝新欧,苏光军,2015-04-15,50万人民币,苏先生,经理,外贸客服/速卖通客服,4000,7000,4-7K,-,经验不限,大专,电子商务,深圳龙华区港深联汇大厦805（清湖地铁口D出口200米）,一般经营项目是：LED灯设计与研发；电子数码产品、电子元器件的研发与销售；国内贸易；货物及技术进出口。，许可经营项目是：LED灯饰与配件、LED灯具的生产加工与销售。
58Job,2021-08-09,50-99人,,超星娱乐文化传媒有限公司,宇灵,吕井忠,2011-10-19,500万人民币,,,国际站外贸销售,5600,8900,5600-8900元/月,招25人,经验不限,大专,其他行业,广东省深圳市龙岗区新生路沿河路2号,一般经营项目是：工艺礼品（象牙及其制品除外）、包装材料、包装制品、办公用品、母婴产品、宠物产品、家居用品、电子产品、数码产品、智能产品、日用百货、工艺品（象牙及其制品除外）、钟表、眼镜、化妆品、纺织品及配件、箱包及配件、时尚配饰、服装、假发、美发产品、口罩、防护服、手套、洗手液、酒精，湿纸巾、防护面罩、护目镜、额温枪的设计、研发、购销（需取得二类医疗器械经营备案后方可经营）；国内贸易（法律、行政法规、国务院决定禁止和规定在登记前须经批准的项目除外）；货物及技术进出口。，许可经营项目是：包装袋和包装饰品的生产加工；
,2021-08-09,20-99人,,深圳市军灿电子商务有限公司,军灿,余君,2013-01-15,51万人民币,余先生,HR,ebay外贸电商运营助理,6000,9000,6-9K·13薪,-,1年以内,大专,电子商务,深圳南山区田寮村工业区A区A区9栋6楼西座,一般经营项目是：网上从事广告业务、国内贸易、电子商务、进出口业务、电子商务信息咨询、网络推广信息咨询；房屋租赁。（（法律、行政法规、国务院决定禁止的项目除外，限制的项目须取得许可后方可经营），许可经营项目是：
58Job,2021-08-09,50-99人,,深圳市昌建顺科技有限公司,昌建顺,易建平,2011-08-06,250万人民币,,,外贸业务员,,,薪资面议,招2人,经验不限,学历不限,原材料和加工,深圳宝安区沙井街道衙边工业区A8栋,一般经营项目是：舞台展示架及配件的技术开发与销售；国内贸易，货物及技术进出口。(以上均不含再生资源回收经营及法律、行政法规、国务院决定规定在登记前须经批准的项目），许可经营项目是：五金制品的技术开发、生产与销售；民用防护用品，劳保用品的生产与销售；
58Job,2021-08-09,1-49人,,深圳市正芯城电子科技有限公司,万旭宏,周镇龙,2015-02-10,100万人民币,,,外贸业务员+双休+五险,5000,8000,5000-8000元/月,招2人,"经验不限,可接收应届生",大专,互联网/电子商务+贸易/进出口,桑达工业区404栋618室,一般经营项目是：电子产品的技术开发，通讯数码产品及配件、计算机周边设备的销售；电脑及周边器材、家用电器、汽车用品的销售；经营电子商务；国内贸易；货物及技术进出口，许可经营项目是：
,2021-08-09,20-99人,,深圳欧鑫莱科技有限公司,欧鑫莱,邹波,2013-07-08,10万人民币,邹先生,CEO,外贸业务员,4000,7000,4-7K·13薪,-,1年以内,本科,电子商务,深圳龙华区尚美中心大厦2505室-2508室,一般经营项目是：电子产品、数码产品、通讯产品、通信产品的销售及技术开发；国内贸易；经营进出口业务，许可经营项目是：
58Job,2021-08-09,50-99人,,深圳市易唯科技有限公司,乔纳斯,郭耸林,2014-09-20,100万人民币,,,外贸专员6000包吃,5000,10000,5000-10000元/月,招5人,1-2年,高中,互联网/电子商务,深圳龙岗区龙岗区龙城街道龙平西路4号志达工业园1栋5楼,一般经营项目是：计算机系统集成；经营电子商务。，许可经营项目是：汽车车载用品、电子产品、安防监控设备及周边产品的技术开发、购销、生产与加工；
,2021-08-09,100-499人,,深圳市必趣科技有限公司,必趣科技,张树泳,2015-04-08,200万人民币,胡女士,招聘主管,硬件技术支持--外贸,6000,8000,6-8K,-,1年以内,大专,智能硬件,深圳市 龙岗区 天安云谷二期4栋座 2006,一般经营项目是：经营电子商务；国内贸易；货物及技术进出口。，许可经营项目是：3D打印机及周边产品的研发、设计、生产加工及销售；3D扫描仪、快速成型机、自动化设备、电子产品研发、生产加工及销售。
58Job,2021-08-09,1-49人,,深圳市桓捷新能源供应链有限公司,通联光,谭政,2014-07-04,200万人民币,,,外贸销售,5000,10000,5000-10000元/月,招5人,经验不限,学历不限,互联网/电子商务+通信/电信,深圳市坪山区兰金四路华瀚科技工业园3号厂房3楼319,一般经营项目是：电子产品，安防设备，监控设备的销售；其他国内贸易，货物及技术进出口。，许可经营项目是：工业级交换机，工业级收发器，光纤收发器，光纤模块，POE设备的研发，组装，加工和销售。
,2021-08-09,20-99人,,深圳市利驰电子商务有限公司,利驰电子商务,马跃,2017-07-26,50万人民币,王女士,人事专员,产品开发/跨境电商产品开发/外贸铺货开发,7000,12000,7-12K,-,1-3年,高中,电子商务,深圳市 龙华区 天汇大厦(油松路) A栋306,一般经营项目是：电子产品的研发、销售及技术咨询；国内贸易；货物及技术进出口；经营电子商务。，许可经营项目是：国内贸易（不含专营、专卖、专控商品）；经营进出口业务（法律、行政法规、国务院决定禁止的项目除外，限制的项目须取得许可后方可经营）。服装、纺织品、针织品、日用百货批发、销售；文化用品、体育用品批发、销售；机械设备、五金产品、电子产品批发、销售；首饰、工艺品批发、销售。
58Job,2021-08-09,1-49人,,深圳市南方华普科技有限公司,南方华普,鄢务生,2014-02-10,500万人民币,,,外贸专员+社保福利好,6000,10000,6000-10000元/月,招3人,1-2年,本科,计算机硬件,广东省深圳市光明区公明上村莲塘冠城低碳产业园E栋B区7楼,一般经营项目是：电子产品、电脑周边设备的研发与销售；国内贸易；货物及技术进出口。，许可经营项目是：电子产品、电脑周边设备的生产。
,2021-08-09,20-99人,,深圳市京虹创科技有限公司,京虹创科技,曹海鲸,2014-07-01,50万人民币,付先生,主管,亚马逊产品开发 精品/接受应届/外贸跨境,5000,10000,5-10K,-,经验不限,大专,贸易/进出口,深圳龙岗区京南工业区京南工业区6B栋603,一般经营项目是：从事货物与及技术进出口、国内贸易；日用百货、宠物日用品、玩具、服装及其配件、饰品及其配件、美容护肤品、美妆配件、围巾、帽、泳衣、内衣、鞋、袜、腰带、电子产品、数码产品、数码配件、眼镜（不含隐形眼镜）、工艺品（象牙及其制品除外）、美容美发用具、皮具、小五金、针纺织品、雨具、手套、箱包及其配件、办公用品、汽车日用品、喜庆日用品、家居日用品、床上用品、家具、陶瓷制品、灯具、厨房用具、玻璃制品、服装辅料、纸制品（不含出版物）、卫浴洁具、塑料制品、母婴日用品（不含食品）、茶具、化妆品（不含危险化学品）、包装材料、运动器材的销售及批发。（法律、行政法规禁止的项目除外；法律、行政法规限制的项目须取得许可后方可经营），许可经营项目是：
58Job,2021-08-09,1-49人,,深圳市精至精密模具有限公司,裕池科技,洪裕聪,2015-05-22,50万人民币,,,外贸业务员,4000,8000,4000-8000元/月,招2人,1-2年,大专,原材料和加工,深圳光公明楼村锂鱼河工业区振兴路14号（定位佩雅时装）,一般经营项目是：国内贸易；货物及技术进出口。，许可经营项目是：机械设备、机械零配件、五金制品的技术开发、生产与销售。
58Job,2021-08-09,1-49人,,深圳市合盛创杰科技有限公司,雄毅华,吴才坤,2010-09-26,1000万人民币,,,外贸业务员,13000,20000,13000-20000元/月,招5人,1-2年,学历不限,原材料和加工,深圳龙岗区龙岗街道新生社区龙贤路2号,一般经营项目是：亚克力、塑胶材料、展示架、绝缘材料的设计与销售；国内贸易；货物及技术进出口。（以上不含限制、禁止项目）。，许可经营项目是：亚克力、塑胶材料、展示架、绝缘材料的加工生产。
58Job,2021-08-09,1-49人,,深圳摩方材料科技有限公司,隆客色,谭林伟,2014-09-23,1000万人民币,,,外贸业务员,5000,10000,5000-10000元/月,招5人,1-2年,大专,互联网/电子商务+原材料和加工+多元化集团,深圳福田华强北赛格广场36楼3603,"一般经营项目是：集成电路布图及相关产品的研发、设计及销售；智能穿戴产品、移动电源、3D眼镜、虚拟现实眼镜、补光灯、移动电源、手机周边产品、遥控产品、无线产品的技术开发；体温计、额温枪、鞋帽,手套、消毒杀菌产品、卫生用品、劳保用品的销售；国内贸易；货物及技术进出口；物业管理。 （法律、行政法规禁止的项目除外；法律、行政法规限制的项目须取得许可证方可经营），许可经营项目是：电子产品及配件的生产;智能电子设备、数码产品、手机配件、相机配件、摄影器材、电子元器件、电脑周边配件的组装、生产及加工;硅胶制品生产;化妆品生产与制造;化妆品工具用具生产;一类、二类医疗器械、医用口罩、医用服装、医用目镜的销售。"
58Job,2021-08-09,50-99人,,深圳市欣东汇科技有限公司,欣东汇,田伟,2007-07-24,1000万人民币,,,双休五险一金聘外贸业务员,,,薪资面议,招6人,1-2年,大专,贸易/进出口+电子技术/半导体/集成电路+仪器仪表/工业自动化,深圳宝安沙井后亭全至科技创新园17E,一般经营项目是：微型电机 、减速电机、直流电机、无刷电机、智能锁电机的研发与销售；智能电子产品的研发和销售；家用电器、塑胶制品、五金制品的销售；国内贸易，货物及技术进出口。(法律、行政法规、国务院决定规定在登记前须经批准的项目除外），许可经营项目是：无
,2021-08-09,100-499人,,深圳市方直科技股份有限公司,方直科技股份,黄元忠,1993-02-19,16783.109万人民币,董女士,HR,学科产品经理（英语）,18000,28000,18-28K·14薪,-,经验不限,本科,在线教育,深圳南山区方直科技股份有限公司大新路198号创新大厦B栋9楼,一般经营项目是：计算机软、硬件、网络及教育软件和教学资源的开发、销售、咨询及其技术服务；计算机系统集成及相关技术服务、信息技术咨询；从事互联网文化活动；电子产品的开发、销售（不含二、三类医疗器械等需许可项目）；经营进出口业务（法律、行政法规、国务院决定禁止的项目除外，限制的项目须取得许可后方可经营）；投资兴办实业（具体项目另行申报）；房屋租赁。，许可经营项目是：出版物批发；第二类增值电信业务中的信息服务业务（仅限互联网信息服务）（凭“中华人民共和国增值电信业务经营许可证粤B2-20110094经营）；第二类增值电信业务中的信息服务业务（不含互联网信息服务）（凭“中华人民共和国增值电信业务经营许可证B2-20173115经营”）。
58Job,2021-08-09,100-499人,,深圳市君豪盛金属材料有限公司,君豪盛,陈国友,2000-07-08,2206万人民币,,,急招外贸业务员,5000,8000,5000-8000元/月,招3人,"经验不限,可接收应届生",本科,钢铁/机械/设备/重工,惠州市仲恺高新区和畅西三路16号厂房A栋一楼,一般经营项目是：销售金属材料、建筑材料、五金制品、磨光棒、六角棒、铜棒及机电产品；不锈钢销售；经营进出口业务（以上均不含法律、行政法规、国务院决定规定需前置审批和禁止的项目）。，许可经营项目是：
,2021-08-09,100-499人,,深圳金亚太科技有限公司,金亚太科技,房纪军,2004-06-19,600万人民币,唐女士,HR,硬件项目经理（英语口语熟练）,12000,24000,12-24K·14薪,-,3-5年,大专,通信/网络设备,深圳市 南山区 深圳国际创新谷 8栋A座10层02-04房,一般经营项目是：研发、生产经营电脑用视频卡/盒、电脑用采集卡/盒、电脑用视频转换器/卡、电脑用电视接收卡/盒、手持数字电视、多媒体播放器、数字影像显示终端、数字电视机顶盒、电子书、家庭数码设备、遥控器（由分公司生产）；计算机软硬件、计算机及网络产品、电子产品系统技术、数字影像显示终端、数字电视软硬件的开发，销售自主开发的产品；并提供技术服务、技术咨询。，许可经营项目是：
58Job,2021-08-09,1-49人,,深圳环亚东升科技有限公司,环亚东升,常亚东,2014-11-20,100万人民币,,,外贸业务双休6k+提成,6000,12000,6000-12000元/月,招5人,3-5年,大专,贸易/进出口+互联网/电子商务,广东省深圳市沙井沙头创智空间商务中心718,一般经营项目是：机械、五金、电子产品周边的非标零配件、体育活动器械、锻炼身体器械、射箭用器具、箭弓、体育用品周边产品的销售；通用体育器械的研发与销售；国内贸易，货物及技术进出口。（法律、行政法规或者国务院决定禁止和规定在登记前须经批准的项目除外），许可经营项目是：
,2021-08-09,20-99人,,广东玫狮家居有限公司,广东玫狮,崔联英,2018-06-07,1000万人民币,陆先生,总经理,亚马逊运营经理/主管（法语、英语、意语）,13000,20000,13-20K·13薪,-,1-3年,本科,电子商务,深圳龙华区上塘商业大厦301-305室,从事床垫、家具、床上用品、家居用品、睡眠电子仪、按摩器、家具材料的研发、销售及进出口业务，佣金代理（不含拍卖）。（以上项目不涉及外商投资准入特别管理措施）（依法须经批准的项目，经相关部门批准后方可开展经营活动）
